{
  "schema_version": 1,
  "captured_at": "2026-08-12T11:40:00Z",
  "host": "codex",
  "host_version": "codex-cli 0.147.0",
  "activation": "default-off",
  "sources": [
    "https://learn.chatgpt.com/docs/agent-configuration/subagents",
    "local:codex features list",
    "local:custom-agent discovery"
  ],
  "capabilities": {
    "agent_discovery": "supported",
    "user_scope": "supported",
    "project_scope": "supported",
    "model_pin": "supported",
    "effort_pin": "supported",
    "native_dispatch": "supported",
    "launch_ack": "partial",
    "result_return": "supported",
    "cancel": "supported",
    "lookup": "supported",
    "idempotency": "unsupported",
    "runtime_attestation": "partial",
    "fresh_session": "unverified"
  },
  "limitations": [
    "No documented Hive-supplied idempotency key",
    "No signed exact role, model, effort, and definition digest receipt",
    "Fresh-session dispatch acceptance remains pending"
  ]
}
